{
  "schema_version": "0.1",
  "task_id": "max-i64-win64-live-worktree-v1",
  "generator_id": "hlax64",
  "repository": {
    "base_revision": "git:3f63c1b5a42b5d288821363fd7e37c95e18290f5",
    "allowed_paths": [
      "src/HlaX64.Compiler/Abi/**",
      "src/HlaX64.Compiler/Ir/**",
      "src/HlaX64.Backend.Nasm/**",
      "tests/HlaX64.Compiler.Tests/**"
    ],
    "forbidden_paths": [
      "**/integrations/hlax64/cases/**/task.vaa.toml",
      "**/integrations/hlax64/cases/**/contract.sem.toml",
      "**/integrations/hlax64/cases/**/vectors.json",
      "**/integrations/hlax64/stack.lock.toml"
    ]
  },
  "failure": {
    "classification": "generator_candidate_violated",
    "diagnostic_code": "BEHAVIOR_VECTOR_MISMATCH_001",
    "message": "SemASM behavior_failed: signed max_i64 returned min (GreaterThanSigned lowered to jl)"
  },
  "generated_artifact": {
    "path": "candidate.asm",
    "digest": "sha256:9a40f12fe9bb0d84f84ac0c4d92413948f04547a27620b32dce5d52e82f2221b"
  },
  "source_mapping": {
    "generator_input": "integrations/hlax64/cases/max_i64/input.hla64:16",
    "ir_node": "CompareKind.GreaterThanSigned",
    "generator_source": "src/HlaX64.Compiler/Abi/WindowsMsAbiLowerer.cs:442"
  },
  "commands": {
    "build": "dotnet build src/HlaX64.Cli/HlaX64.Cli.csproj -c Release --nologo",
    "regenerate": "./scripts/run-hlax64-suite.ps1 -Gate -Suite integrations/hlax64/suites/scalar-i64-win64.vaa-suite.toml -Repo ../hlax64-live-repair-win64-max-signed",
    "verify": "dotnet test tests/HlaX64.Compiler.Tests/HlaX64.Compiler.Tests.csproj --filter FullyQualifiedName~Emit_Win64SignedGreaterThan_UsesAboveBranch"
  },
  "constraints": [
    "Do not edit generated assembly manually",
    "Do not edit contracts, vectors, task files, or stack.lock.toml",
    "Regenerate all candidates after generator changes",
    "Run the required regression suite before completion"
  ]
}