{
  "schema_version": "0.1",
  "task_id": "min-i64-win64-live-v1",
  "generator_id": "hlax64",
  "repository": {
    "base_revision": "git:485fca874727763376a67204b243d63aec73dbee",
    "allowed_paths": [
      "src/HlaX64.Compiler/Abi/**",
      "src/HlaX64.Compiler/Ir/**",
      "src/HlaX64.Backend.Nasm/**",
      "tests/HlaX64.Compiler.Tests/**"
    ],
    "forbidden_paths": [
      "**/integrations/hlax64/cases/**/task.vaa.toml",
      "**/integrations/hlax64/cases/**/contract.sem.toml",
      "**/integrations/hlax64/cases/**/vectors.json",
      "**/integrations/hlax64/stack.lock.toml"
    ]
  },
  "failure": {
    "classification": "generator_candidate_violated",
    "diagnostic_code": "BEHAVIOR_VECTOR_MISMATCH_001",
    "message": "SemASM behavior_failed: signed min_i64 returned max (locked wrong GreaterThan branch / jg)"
  },
  "generated_artifact": {
    "path": "candidate.asm",
    "digest": "sha256:58a214910ec6cbb6c824c75c184601f8243ad7e115b94e19f78c8f3a51a2a838"
  },
  "source_mapping": {
    "generator_input": "integrations/hlax64/cases/min_i64_wrong/input.hla64:14",
    "ir_node": "CompareKind.GreaterThanSigned",
    "generator_source": "src/HlaX64.Compiler/Abi/WindowsMsAbiLowerer.cs:442"
  },
  "commands": {
    "build": "dotnet build src/HlaX64.Cli/HlaX64.Cli.csproj -c Release --nologo",
    "regenerate": "./scripts/run-hlax64-suite.ps1 -Gate -Suite integrations/hlax64/suites/scalar-i64-win64.vaa-suite.toml",
    "verify": "dotnet test tests/HlaX64.Compiler.Tests/HlaX64.Compiler.Tests.csproj -c Release"
  },
  "constraints": [
    "Do not edit generated assembly manually",
    "Do not edit contracts, vectors, task files, or stack.lock.toml",
    "Regenerate all candidates after generator changes",
    "Run the required regression suite before completion"
  ]
}